"2494","Hirakud Reservoir","Asia","India","","2021-10-12","2022-10-31","65400","21.61076803754","83.766452757071","<p>Hirakud Reservoir is one of the largest man-made reservoirs in India, built across the Mahanadi River by a combination of earth and modern dams of a total length of almost 26 kilometres. The reservoir helps regulate the water level of the river and moderates the impact of floods in the Mahanadi Delta. It provides habitat for over 130 bird species and about 54 fish, with one classified as endangered and six others as near-threatened. 21 fish species are economically important to the region as they provide a total yield of 480 tonnes per year, supporting the livelihoods of over 7,000 fishermen. The reservoir also produces around 350 megawatts of hydropower and irrigates 436,000 hectares of land. The rich biodiversity and other recreational activities in and around the reservoir make it a popular tourist destination, with over 30,000 tourists visiting annually.</p>","Yes","Yes","Yes","Yes","Yes","Yes","No","Yes","No","Human-made wetlands, 6: Water storage areas/Reservoirs, Inland wetlands, P: Seasonal/ intermittent freshwater lakes","195","192","No","No","Yes","Cultural Services, Recreation and tourism, Spiritual and inspirational, Scientific and educational, Provisioning Services, Fresh water, Supporting Services, Biodiversity, Regulating Services, Maintenance of hydrological regimes, Hazard reduction","Climate change & severe weather, Storms and flooding, Human settlements (non agricultural), Commercial and industrial areas, Housing and urban areas, Water regulation, Water releases, Agriculture & aquaculture, Marine and freshwater aquaculture, Biological resource use, Fishing and harvesting aquatic resources, Human intrusions & disturbance, Recreational and tourism activities, Natural system modifications, Dams and water management/use, Pollution, Agricultural and forestry effluents","Bargarh district","","","Overlapping site categories, Non-statutory designations, Important Bird Area","No","No"
"1570","Hokera Wetland","Asia","India","","2005-11-08","2005-11-08","1375","34.0833333333","74.7","Hokera Wetland. 08/11/05; Jammu & Kashmir; 1,375 ha; 34°05'N 074°42'E. Located at the northwest Himalayan biogeopgraphic province of Kashmir, back of the snow-draped Pir Panchal (1,584m asl.), Hokera wetland is only 10 km from scenic paradise of Srinagar. A natural perennial wetland contiguous to the Jhelum basin, it is the only site with remaining reedbeds of Kashmir and pathway of 68 waterfowl species like Large Egret, Great Crested Grebe, Little Cormorant, Common Shelduck, Tufted Duck and endangered White-eyed Pochard, coming from Siberia, China, Central Asia, and Northern Europe. It is an important source of food, spawning ground and nursery for fishes, besides offering feeding and breeding ground to a variety of water birds. Typical marshy vegetation complexes inhabit like Typha, Phragmites, Eleocharis, Trapa, and Nymphoides species ranging from shallow water to open water aquatic flora. Sustainable exploitation of fish, fodder and fuel is significant, despite water withdrawals since 1999. Potential threats include recent housing facilities, littered garbage, and demand for increasing tourist facilities. Ramsar site no. 1570. Most recent RIS information: 2005.","No","Yes","No","Yes","Yes","No","No","Yes","No","Inland wetlands, Y: Permanent Freshwater springs; oases, Xf: Freshwater, tree-dominated wetlands, Xp: Permanent Forested peatlands, Zk(b): Karst and other subterranean hydrological systems, W: Shrub-dominated wetlands, U: Permanent Non-forested peatlands","1584","1584","No","No","In preparation","Provisioning Services, Wetland non-food products, Food for humans, Fresh water, Regulating Services, Erosion protection, Hazard reduction, Biological control of pests and disease, Maintenance of hydrological regimes, Climate regulation, Cultural Services, Scientific and educational","Pollution, Agricultural and forestry effluents, Garbage and solid waste, Natural system modifications, Unspecified/others, Vegetation clearance/ land conversion, Human settlements (non agricultural), Housing and urban areas, Invasive and other problematic species and genes, Problematic native species, Water regulation, Water abstraction","Jammu and Kashmir State","","","","No","No"
"2496","Hygam Wetland Conservation Reserve ","Asia","India","","2022-06-08","2022-10-31","801.82","34.240257326537","74.526877947224","<p>The Hygam wetland lies downstream of another Ramsar Site (Wular Lake, <a target=""_blank"" href=""https://rsis.ramsar.org/ris/461"">Site no.461</a>), with which it is connected, and forms an important site for biodiversity conservation. It lies on the Central Asian Flyway and over 40,000 migratory and resident bird species have been recorded annually. The wetland also supports mammals, amphibians, and fish including Eurasian otter (<em>Lutra lutra</em>), common carp (<em>Cyprinus carpio</em>) and common pochard (<em>Aythya ferina</em>). The wetland is located within the Jhelum river basin and plays a significant role in flood control, aquifer recharge, and regulating water flow of the Wular Lake. This wetland provides local communities with a range of &ldquo;ecosystem services&rdquo;, providing fish, wood and clean water, and regulating the local climate. However, it is increasingly threatened by continuous siltation, willow plantations and nutrient accumulation. To tackle these issues, the government of Jammu and Kashmir has been implementing an integrated management action plan since 2002.</p>","Yes","Yes","Yes","No","Yes","Yes","No","No","No","Inland wetlands, Ts: Seasonal/ intermittent freshwater marshes/ pools on inorganic soils","1580","1579","No","No","In preparation","Supporting Services, Nutrient cycling, Biodiversity, Provisioning Services, Food for humans, Fresh water, Regulating Services, Maintenance of hydrological regimes, Cultural Services, Recreation and tourism, Scientific and educational","Human settlements (non agricultural), Unspecified development, Water regulation, Drainage, Canalisation and river regulation, Water abstraction, Agriculture & aquaculture, Wood and pulp plantations, Annual and perennial non-timber crops, Biological resource use, Fishing and harvesting aquatic resources, Human intrusions & disturbance, Unspecified/others, Pollution, Household sewage, urban waste water, Garbage and solid waste, Climate change & severe weather, Habitat shifting and alteration","The wetland is 40 km from Srinagar, the UT summer capital and located in district Baramulla (34015'N, 74031’E) of Jammu & Kashmir on the flood plains of river Jhelum at an altitudinal height of 1580 m asl.","","","Overlapping site categories, Non-statutory designations, Important Bird Area","No","No"
"2436","Kabartal Wetland","Asia","India","","2020-07-21","2020-10-16","2620","25.618149913425","86.139468042432","<p>Kabartal Wetland, also known as Kanwar Jheel, covers 2,620 hectares of the Indo-Gangetic plains in the northern Bihar State. The Site is one of 18 wetlands within an extensive floodplain complex; it floods during the monsoon season to a depth of 1.5 metres. This absorption of floodwaters is a vital service in Bihar State where 70% of the land is vulnerable to inundation. During the dry season, areas of marshland dry out and are used for agriculture. Significant biodiversity is present, with 165 plant species and 394 animal species recorded, including 221 bird species. The Wetland is an important stopover along the Central Asian Flyway, with 58 migratory waterbirds using it to rest and refuel. It is also a valuable site for fish biodiversity with over 50 species documented. Five critically endangered species inhabit the site, including three vultures &ndash; the red-headed vulture (<em>Sarcogyps calvus</em>), white-rumped vulture (<em>Gyps bengalensis</em>) and Indian vulture (<em>Gyps indicus</em>) &ndash; and two waterbirds, the sociable lapwing (<em>Vanellus gregarius</em>) and Baer&rsquo;s pochard (<em>Aythya baeri</em>). Major threats to the Site include water management activities such as drainage, water abstraction, damming and canalization.</p>","Yes","Yes","Yes","Yes","No","No","Yes","Yes","No","Human-made wetlands, 2: Ponds, Inland wetlands, W: Shrub-dominated wetlands","45","27","No","No","Yes","Provisioning Services, Food for humans, Fresh water, Wetland non-food products, Genetic materials, Regulating Services, Maintenance of hydrological regimes, Erosion protection, Pollution control and detoxification, Climate regulation, Biological control of pests and disease, Hazard reduction, Cultural Services, Recreation and tourism, Spiritual and inspirational, Scientific and educational, Supporting Services, Biodiversity, Soil formation, Nutrient cycling","Climate change & severe weather, Droughts, Human settlements (non agricultural), Housing and urban areas, Water regulation, Drainage, Water abstraction, Canalisation and river regulation, Agriculture & aquaculture, Annual and perennial non-timber crops, Livestock farming and ranching, Transportation and service corridors, Roads and railroads, Biological resource use, Hunting and collecting terrestrial animals, Natural system modifications, Dams and water management/use, Vegetation clearance/ land conversion, Invasive and other problematic species and genes, Invasive non-native/ alien species","The wetland is situated in Begusarai district in the state of Bihar","","","Overlapping site categories, Non-statutory designations, Important Bird Area","No","No"
"2486","Kanjirankulam Bird Sanctuary","Asia","India","","2022-04-08","2022-10-31","96.891","9.3597305616574","78.479065972257","<p>Kanjirankulam Bird Sanctuary is a nationally protected area and a notable nesting site for several migratory heron species. It is dominated by sub-tropical forests of babul (<em>Acacia nilotica</em>) that provide habitat for endemic and migratory birds including near-threatened species such as painted stork (<em>Mycteria leucocephala</em>), spot-billed pelican (<em>Pelecanus philippensis</em>), oriental darter (<em>Anhinga melanogaster</em>)&nbsp;and oriental white ibis (<em>Threskiornis melanocephalus</em>). Recent growth of invasive <em>Prosopis</em> trees has affected the growth of the indigenous babul populations, threatening the habitat of these birds. Besides its rich biodiversity, the wetland supports the adjacent ecosystems and communities by providing irrigation, flood control, and erosion control. It is culturally important to the local communities, who are known to protect the birds from poaching and other threats. The wetland is sensitive to climate changes which heavily influence the seasonal variability of the water level.</p>","No","Yes","Yes","No","No","Yes","Yes","Yes","No","Inland wetlands, Xf: Freshwater, tree-dominated wetlands","70","30","No","No","Yes","Cultural Services, Scientific and educational, Recreation and tourism, Supporting Services, Biodiversity, Soil formation, Nutrient cycling, Provisioning Services, Fresh water, Wetland non-food products, Regulating Services, Maintenance of hydrological regimes, Climate regulation, Erosion protection","Water regulation, Water abstraction, Drainage, Water releases, Agriculture & aquaculture, Livestock farming and ranching, Biological resource use, Logging and wood harvesting, Gathering terrestrial plants, Human intrusions & disturbance, Unspecified/others, Climate change & severe weather, Droughts, Temperature extremes, Storms and flooding, Transportation and service corridors, Unspecified, Natural system modifications, Vegetation clearance/ land conversion, Invasive and other problematic species and genes, Invasive non-native/ alien species, Pollution, Excess heat, sound, light, Unspecified, Human settlements (non agricultural), Unspecified development","Peraiyur Panchayat, Mudukulathur Taluk, Ramanathapuram District, Tamilnadu, India","","","Overlapping site categories, Non-statutory designations, Important Bird Area","No","No"
"1160","Kanjli","Asia","India","","2002-01-22","2002-01-22","183","31.416666666667","75.366666666667","Kanjli. 22/01/02;. Punjab; 183 ha; 31°25'N 075°22'E. A permanent stream, the Kali Bein, converted by construction of a small barrage in 1870 into a water storage area for irrigation purposes. The site fulfils Criteria 3 because of its importance in supporting a considerable diversity of aquatic, mesophytic, and terrestrial flora and fauna in the biogeographical region, and acts also as a key regulator of groundwater discharge and recharge with the seasons. By this means and by direct abstraction of water for irrigation by the local population, the site plays a crucial role in the agriculture which predominates on the surrounding fertile plain, with fewer pressures upon water supplies than elsewhere in the Punjab. The invasive water hyacinth is present and must be removed from time to time; increasing pollution levels, deforestation in the catchment area, and excessive grazing are seen as potential threats. The stream is considered to be the most significant in the state from the religious point of view, as it is associated with the first guru of the Sikhs, Shri Guru Nanak Dev Ji. The stream itself and surrounding marsh is under provincial ownership and surrounding areas privately owned. The site is a center for environmental tourism and picnicking. Ramsar site no. 1160. Most recent RIS information: 2001.","No","No","Yes","No","No","No","No","No","No","Human-made wetlands, 6: Water storage areas/Reservoirs, Inland wetlands, M: Permanent rivers/ streams/ creeks","","210","No","Yes","Yes","Regulating Services, Maintenance of hydrological regimes, Pollution control and detoxification, Hazard reduction, Provisioning Services, Fresh water, Cultural Services, Recreation and tourism, Spiritual and inspirational","Natural system modifications, Unspecified/others, Dams and water management/use, Vegetation clearance/ land conversion, Agriculture & aquaculture, Livestock farming and ranching, Invasive and other problematic species and genes, Invasive non-native/ alien species, Pollution, Unspecified, Industrial and military effluents, Household sewage, urban waste water, Human settlements (non agricultural), Housing and urban areas, Commercial and industrial areas","Punjab","","","","No","No"
"2537","Karaivetti Bird Sanctuary","Asia","India","","2023-05-24","2024-01-31","453.715","10.98025802633","79.045739435954","<p>The Site is one of the largest inland freshwater lakes in the State of Tamil Nadu. It provides important stopover and foraging ground for birds migrating along the Central Asian Flyway. Some 10,000 individuals of 14 colonial waterbird species have been found nesting here. The gum Arabic tree (<em>Acacia nilotica</em>) provides roosting and nesting grounds for threatened species such as spotted eagle (<em>Aquila clanga</em>), tawny eagle (<em>Aquila rapax</em>) and Indian darter (<em>Anhinga melanogaster</em>). When the water level starts receding after January, larger birds such as painted stork (<em>Mycteria leucocephala</em>) flock to the Site; it has recorded one of the largest congregations of waterbirds among all lakes in the State of Tamil Nadu. The Site also provides breeding habitat for the vulnerable Indian flap-shelled turtle (<em>Lissemys punctata</em>). During the driest period, between July and October, the water level of the Site is maintained with water from the Mettur Dam. The lake water is used to irrigate about 4,000 hectares of surrounding farmland. There are issues related to human-wildlife conflict, in particularly concerning the vulnerable bonnet macaque (<em>Macaca radiata</em>).</p>","No","Yes","Yes","Yes","Yes","Yes","No","No","No","Inland wetlands, O: Permanent freshwater lakes","55","52","No","No","No","Provisioning Services, Fresh water, Regulating Services, Maintenance of hydrological regimes, Erosion protection, Climate regulation, Hazard reduction, Biological control of pests and disease, Cultural Services, Recreation and tourism, Supporting Services, Biodiversity, Pollination, Nutrient cycling","Human settlements (non agricultural), Housing and urban areas, Water regulation, Dredging, Water abstraction, Water releases, Agriculture & aquaculture, Livestock farming and ranching, Biological resource use, Fishing and harvesting aquatic resources, Human intrusions & disturbance, Recreational and tourism activities, Climate change & severe weather, Habitat shifting and alteration, Droughts, Temperature extremes, Storms and flooding, Pollution, Agricultural and forestry effluents, Invasive and other problematic species and genes, Invasive non-native/ alien species, Natural system modifications, Vegetation clearance/ land conversion","Ariyalur District","","","Overlapping site categories, Non-statutory designations, Important Bird Area","No","No"
"2480","Karikili Bird Sanctuary ","Asia","India","","2022-04-08","2022-07-25","58.442","12.598929845085","79.842419721553","<p>The Karikili Bird Sanctuary comprises two rain-fed non-perennial irrigation tanks spreading over an area of more than 58 hectares. The Site is flat or gently undulating and lies near low ridged, rocky hillocks. Rainfall varies greatly from year to year, from 400 mm to almost 1,700 mm, flooding the Site in the monsoon months from July to September. The vegetation is mainly composed of <em>Barringtonia acutangula</em> and <em>Acacia nilotica </em>trees, raised as plantations by the Forest Department. Surrounding vegetation is composed of scrub and thorn. The Site provides habitat for a variety of resident and migratory birds, most of them waterbirds, as well as a few species of scavengers. The near-threatened oriental darter (<em>Anhinga melanogaster</em>) and spot-billed pelican (<em>Pelecanus philippensis</em>) breed here. The wetland also supports several mammal, reptile and amphibian species such as the jungle cat, bonnet macaque, jackal, python, sand boa and frogs. The Karikili Bird Sanctuary has a history of people cooperating in protecting waterbirds, as their guano enables the supply of nutrient-enriched water to crop fields. The Site was declared a Birds Sanctuary in 1972 and a management plan is currently being implemented to safeguard the biodiversity of the Site as well as the ecosystem services provided to the local communities.</p>","No","No","Yes","Yes","No","Yes","Yes","No","No","Human-made wetlands, 6: Water storage areas/Reservoirs","100","23","No","Yes","Yes","Provisioning Services, Food for humans, Fresh water, Regulating Services, Maintenance of hydrological regimes, Erosion protection, Climate regulation, Biological control of pests and disease, Hazard reduction, Cultural Services, Recreation and tourism, Spiritual and inspirational, Supporting Services, Biodiversity, Soil formation, Nutrient cycling, Pollination","Invasive and other problematic species and genes, Invasive non-native/ alien species, Human settlements (non agricultural), Housing and urban areas, Commercial and industrial areas, Agriculture & aquaculture, Annual and perennial non-timber crops, Biological resource use, Fishing and harvesting aquatic resources","Partly Maduranthagam Taluk, Chengalpattu District & partly Kancheepuram District","","","Overlapping site categories, Non-statutory designations, Important Bird Area","No","No"
"2548","Kazhuveli Bird Sanctuary","Asia","India","","2024-01-16","2024-08-22","5151.6","12.110294041978","79.861503569022","<p>The Site, the second largest brackish lake in Peninsular India, was designated as a Bird Sanctuary in 2021. It is connected to the Bay of Bengal in the north via Uppukalli creek, and receives seawater during high tides or cyclones. As a result, the salinity of the wetland varies, with saltier water in the north transitioning to fresh water in the south at Kazhuveli basin. This variation allows the wetland to act as a migratory path and spawning ground for multiple fish species. The gum arabic tree (<em>Vachellia nilotica</em>) and Jerusalem thorn (<em>Parkinsonia aculeata</em>) found in the Site provide nesting areas for over 2,000 colonial nesting birds each breeding season, particularly for the spot-billed pelican (<em>Pelecanus philippensis</em>). Located along the central Asian flyway, the Site also provides feeding grounds for migratory species such as the vulnerable spotted eagle (<em>Aquila clanga</em>), imperial eagle (<em>Aquila heliaca</em>) and river tern (<em>Sterna aurantia</em>). Its swampy areas offer suitable nesting grounds for the vulnerable Indian flap-shelled turtle (<em>Lissemys punctata</em>) and Indian star tortoise (<em>Geochelone elegans</em>). Overall, the diverse habitats support 229 species of birds, 85 fish, 72 butterflies, 39 reptiles, 13 amphibians and 14 mammals. Hence, the Site is popular amongst nature enthusiasts, bird watchers, wildlife photographers and researchers.</p>","Yes","Yes","Yes","Yes","No","Yes","Yes","Yes","No","Marine or coastal wetlands, J: Coastal brackish / saline lagoons","45","0","No","Yes","Yes","Provisioning Services, Food for humans, Fresh water, Wetland non-food products, Regulating Services, Climate regulation, Erosion protection, Cultural Services, Recreation and tourism, Scientific and educational, Supporting Services, Biodiversity, Nutrient cycling","Human settlements (non agricultural), Housing and urban areas, Commercial and industrial areas, Water regulation, Salinisation, Canalisation and river regulation, Agriculture & aquaculture, Livestock farming and ranching, Energy production and mining, Mining and quarrying, Biological resource use, Gathering terrestrial plants, Fishing and harvesting aquatic resources, Hunting and collecting terrestrial animals, Natural system modifications, Vegetation clearance/ land conversion, Dams and water management/use, Invasive and other problematic species and genes, Invasive non-native/ alien species, Pollution, Household sewage, urban waste water, Agricultural and forestry effluents, Industrial and military effluents, Climate change & severe weather, Droughts, Storms and flooding","Tamil Nadu","","","Overlapping site categories, Non-statutory designations, Important Bird Area","No","No"
"230","Keoladeo National Park","Asia","India","","1981-10-01","1981-10-01","2873","27.216666666667","77.533333333333","Keoladeo National Park. 01/10/81; Rajasthan; 2,873 ha; 27°13'N 077°32'E. Added to the Montreux Record, 4 July 1990. World Heritage Site; National Park; Bird Sanctuary. A complex of ten artificial, seasonal lagoons, varying in size, situated in a densely populated region. Vegetation is a mosaic of scrub and open grassland that provides habitat for breeding, wintering and staging migratory birds. Also supported are five species of ungulates, four species of cats, and two species of primates, as well as diverse plants, fish and reptiles. The canal provides water for agriculture and domestic consumption. Cattle and water buffalo graze on the site. A field research station exists. Placed on the Montreux Record in 1990 due to ""water shortage and an unbalanced grazing regime"". Additionally, the invasive growth of the grass Paspalum distichum has changed the ecological character of large areas of the site, reducing its suitability for certain waterbird species, notably the Siberian crane. Subject of Ramsar Advisory Missions in 1988 and 1990. Ramsar site no. 230.","No","Yes","No","No","No","No","No","No","No","Inland wetlands, Tp: Permanent freshwater marshes/ pools, Ts: Seasonal/ intermittent freshwater marshes/ pools on inorganic soils, P: Seasonal/ intermittent freshwater lakes, Human-made wetlands, 6: Water storage areas/Reservoirs","","","Yes","No","No","Provisioning Services, Fresh water, Cultural Services, Scientific and educational","Climate change & severe weather, Droughts, Natural system modifications, Dams and water management/use, Unspecified/others","Rajasthan","Overlapping site categories, Global international legal and other formal, World Heritage site","","","No","Yes"
