"2370","Sundarban Wetland","Asia","India","","2019-01-30","2019-01-31","423000","21.774917928894","88.714414161689","<p>Sundarban Wetland is located within the largest mangrove forest in the world, the Sundarbans, that encompasses hundreds of islands and a maze of rivers, rivulets and creeks, in the delta of the Rivers Ganges and Brahmaputra on the Bay of Bengal in India and Bangladesh. The Indian Sundarban, covering the south-westernmost part of the delta, constitutes over 60% of the country&rsquo;s total mangrove forest area and includes 90% of Indian mangrove species. The mangrove forests protect the hinterland from storms, cyclones, tidal surges, and the seepage and intrusion of saltwater inland and into waterways. They serve as nurseries to shellfish and finfish and sustain the fisheries of the entire eastern coast. The Sundarban Tiger Reserve is situated within the Site and part of it has been declared a &ldquo;critical tiger habitat&rdquo; under national law and also a &ldquo;Tiger Conservation Landscape&rdquo; of global importance. The Sundarbans are the only mangrove habitat which supports a significant population of tigers, and they have unique aquatic hunting skills. The Site is also home to a large number of rare and globally threatened species such as the critically endangered northern river terrapin (<em>Batagur baska</em>), the endangered Irrawaddy dolphin (<em>Orcaella brevirostris</em>), and the vulnerable fishing cat (<em>Prionailurus viverrinus</em>). Two of the world&rsquo;s four horseshoe crab species, and eight of India&rsquo;s 12 species of kingfisher are also found here. The uniqueness of the habitat and its biodiversity, and the many tangible and intangible, local, regional and global services they provide, makes the Site&rsquo;s protection and management a conservation priority.</p>","No","Yes","Yes","No","No","No","Yes","Yes","No","Marine or coastal wetlands, F: Estuarine waters, J: Coastal brackish / saline lagoons","6","","No","Yes","Yes","Cultural Services, Scientific and educational, Spiritual and inspirational, Recreation and tourism, Supporting Services, Biodiversity, Provisioning Services, Food for humans, Wetland non-food products, Regulating Services, Erosion protection, Climate regulation, Hazard reduction","Human settlements (non agricultural), Tourism and recreation areas, Water regulation, Dredging, Salinisation, Energy production and mining, Oil and gas drilling, Transportation and service corridors, Utility and service lines (e.g., pipelines), Biological resource use, Fishing and harvesting aquatic resources, Hunting and collecting terrestrial animals, Logging and wood harvesting, Human intrusions & disturbance, Recreational and tourism activities, Pollution, Air-borne pollutants","The Headquaters of the Sundarban Tiger Reserve is located at Canning town, South 24 Parganas district and is connected with broad gauge railway line with Sealdah South suburban station, which is 46 kms from Canning.","Overlapping site categories, Global international legal and other formal, World Heritage site, UNESCO Biosphere Reserve","","","Yes","No"
"2440","Sur Sarovar ","Asia","India","","2020-08-21","2020-11-11","431","27.251875251183","77.840266384221","<p>Sur Sarovar, also known as Keetham Lake, is a human-made reservoir; originally created to supply water to the city of Agra in summer, the wetland soon became an important and rich ecosystem. The Site&rsquo;s patchwork of different habitat types provides refuge to resident and migratory birds, and more than 60 species of fish. Threatened species include the vulnerable greater spotted eagle (<em>Clanga clanga</em>), sarus crane (<em>Grus antigone</em>) and catfish <em>Wallago attu</em>. The Site is important for bird species which migrate on the Central Asian flyway, with over 30,000 waterbirds known to visit the reservoir annually. Over 1% of the South Asian regional population of the greylag goose (<em>Anser anser</em>) is present. Unsustainable tourism, invasive species, and household sewage and urban wastewater present significant threats to the Site.</p>","No","Yes","Yes","Yes","Yes","Yes","Yes","No","No","Human-made wetlands, 6: Water storage areas/Reservoirs","176","166","No","Yes","Yes","Provisioning Services, Food for humans, Fresh water, Regulating Services, Maintenance of hydrological regimes, Hazard reduction, Cultural Services, Recreation and tourism, Spiritual and inspirational, Scientific and educational, Supporting Services, Biodiversity","Human settlements (non agricultural), Tourism and recreation areas, Agriculture & aquaculture, Livestock farming and ranching, Annual and perennial non-timber crops, Biological resource use, Logging and wood harvesting, Fishing and harvesting aquatic resources, Human intrusions & disturbance, Recreational and tourism activities, Unspecified/others, Invasive and other problematic species and genes, Invasive non-native/ alien species, Water regulation, Drainage, Water releases, Pollution, Household sewage, urban waste water","The wetland is located on Delhi-Mathura highway (National Highway-2), in Agra district, Uttar Pradesh","","","Overlapping site categories, Non-statutory designations, Important Bird Area","No","No"
"1573","Surinsar-Mansar Lakes","Asia","India","","2005-11-08","2005-11-08","350","32.75","75.2","Surinsar-Mansar Lakes. 08/11/05; Jammu & Kashmir; 350 ha; 32°45'N 075°12'E. Wildlife Sanctuary, Hindu sacred site. Freshwater composite lake in semi-arid Panjab Plains, adjoining the Jhelum Basin with catchment of sandy conglomeratic soil, boulders and pebbles. Surinsar is rain-fed without permanent discharge, and Mansar is primarily fed by surface run-off and partially by mineralised water through paddy fields, with inflow increasing in rainy season. The lake supports CITES and IUCN Redlisted Lissemys punctata, Aspideretes gangeticus, and Mansariella lacustris. This composite lake is high in micro nutrients for which it is an attractive habitat, breeding and nursery ground for migratory waterfowls like Fulica atra, Gallinula chloropus, Podiceps nigricollis, Aythya fuligula, and various Anas species. The site is socially and culturally very important with many temples around owing to its mythical origin from the Mahabharata period. Although the lakes support variety of fishes, fishing is discouraged for religious values. The main threats are increasing visitors, agricultural runoff, bathing and cremation rituals. Conservation is focused on awareness-raising. Ramsar site no.1573. Most recent RIS information: 2005.","No","Yes","Yes","Yes","No","No","No","No","No","Inland wetlands, O: Permanent freshwater lakes","710","605","No","No","In preparation","Provisioning Services, Fresh water, Wetland non-food products, Cultural Services, Spiritual and inspirational, Recreation and tourism, Regulating Services, Hazard reduction","Human intrusions & disturbance, Recreational and tourism activities, Human settlements (non agricultural), Tourism and recreation areas, Pollution, Household sewage, urban waste water, Agricultural and forestry effluents, Garbage and solid waste, Unspecified, Natural system modifications, Vegetation clearance/ land conversion","Jammu, Kashmir State","","","","No","No"
"2489","Tampara Lake","Asia","India","","2021-10-12","2022-10-31","300","19.350784286474","85.00116124137","<p>The use of explosives during a battle in the Ganjam district between the British East India Company and French colonists in 1766 created a large depression which later became Tampara Lake. The lake is now connected to the Rushikulya river and helps in flood control during the monsoon season. The lake receives flood waters coming from the river, making its biodiversity highly vulnerable to extreme heat and dry weather. The wetland supports 60 species of birds and 46 fish species, including vulnerable species such as common carp (<em>Cyprinus carpio</em>), common pochard (<em>Aythya ferina</em>) and river tern (<em>Sterna aurantia</em>). With an estimated average fish yield of 12 tonnes per year, the wetland is an important source of livelihoods for the local communities. Along with fish, the wetland also provides water for agriculture and domestic use and is used for recreation. It also provides a water pathway for local transportation of goods.</p>","No","Yes","Yes","No","No","No","Yes","Yes","No","Marine or coastal wetlands, K: Coastal freshwater lagoons","10","7","No","No","In preparation","Provisioning Services, Fresh water, Regulating Services, Maintenance of hydrological regimes, Cultural Services, Recreation and tourism, Supporting Services, Nutrient cycling","Water regulation, Water abstraction, Biological resource use, Fishing and harvesting aquatic resources, Human intrusions & disturbance, Recreational and tourism activities, Invasive and other problematic species and genes, Problematic native species, Pollution, Household sewage, urban waste water, Agricultural and forestry effluents, Human settlements (non agricultural), Housing and urban areas, Tourism and recreation areas, Climate change & severe weather, Droughts, Storms and flooding","Ganjam District, Odisha,India","","","Overlapping site categories, Non-statutory designations, Important Plant Area","No","No"
"2547","Tawa Reservoir","Asia","India","","2024-01-08","2024-08-22","20050","22.512734519386","78.000257458871","<p>The Site is a man-made wetland which was created primarily for irrigation through the construction of Tawa Dam. It is located within Satpura Tiger Reserve, in the Central Indian Highlands. The largest protected area in Madhya Pradesh, the Site supports 57 fish species, 21 mammals, over 280 migratory birds, and a rich diversity of aquatic plants. Notably, it is an important fish spawning ground, hosting indigenous species such as the vulnerable common carp (<em>Cyprinus carpio</em>) and shark catfish (<em>Wallago attu</em>). In addition, the Site harbours the state fish of Madhya Pradesh, the tor mahseer (<em>Tor tor</em>)<em>, </em>which is revered as a &ldquo;god fish&rdquo; by local communities. The Site and its environs also provide habitat to the Indian giant squirrel (<em>Ratufa indica</em>), which is endemic to India. Alongside its ecological functions, the Site is a popular tourist destination for recreational activities such as boating and camping.</p>","No","Yes","Yes","Yes","No","No","Yes","Yes","No","Human-made wetlands, 6: Water storage areas/Reservoirs","370","370","No","No","No","Provisioning Services, Food for humans, Fresh water, Genetic materials, Wetland non-food products, Regulating Services, Maintenance of hydrological regimes, Erosion protection, Pollution control and detoxification, Climate regulation, Hazard reduction, Cultural Services, Recreation and tourism, Spiritual and inspirational, Scientific and educational, Supporting Services, Biodiversity, Soil formation, Nutrient cycling","Climate change & severe weather, Storms and flooding, Habitat shifting and alteration, Temperature extremes, Human settlements (non agricultural), Housing and urban areas, Tourism and recreation areas, Water regulation, Water abstraction, Water releases, Canalisation and river regulation, Agriculture & aquaculture, Annual and perennial non-timber crops, Livestock farming and ranching, Marine and freshwater aquaculture, Transportation and service corridors, Roads and railroads, Biological resource use, Fishing and harvesting aquatic resources, Human intrusions & disturbance, Recreational and tourism activities, Pollution, Agricultural and forestry effluents, Geological events, Unspecified, Invasive and other problematic species and genes, Invasive non-native/ alien species, Natural system modifications, Dams and water management/use","The Tawa Reservoir is situated in Narmadapuram District in the state of Madhya Pradesh","","","","No","No"
"2490","Thane Creek","Asia","India","","2022-04-13","2022-10-31","6521.08","19.108664749162","72.965051259009","<p>The Site is one of the largest creeks of Asia and hosts many birds migrating on the Central Asian Flyway. As a sanctuary for flamingos and other important bird species, it is in the list of Important Bird and Biodiversity Areas (IBAs). Thane Creek falls under the Marine Ecoregions of the World (MEOW) but is fed by numerous freshwater sources, making the water brackish. Its mangrove forests provide nurseries for several fish species, sustaining the local fisheries, and also act as a natural buffer against floods, cyclones and seawater intrusions, enhancing the resilience of surrounding areas to such climate-related hazards. The Creek features a rich biodiversity of birds, fish, crustaceans, molluscs, butterflies, and floral species, some of which are threatened, such as the vulnerable Sulawesi fruit bat (<em>Acerodon celebensis</em>), Mozambique tilapia (<em>Oreochromis mossambicus</em>) and river tern (<em>Sterna aurantia</em>), and the endangered great knot (<em>Calidris tenuirostris</em>).</p>","Yes","Yes","Yes","Yes","Yes","Yes","Yes","Yes","No","Marine or coastal wetlands, I: Intertidal forested wetlands","5","0","No","Yes","Yes","Regulating Services, Maintenance of hydrological regimes, Erosion protection, Pollution control and detoxification, Climate regulation, Hazard reduction, Cultural Services, Recreation and tourism, Spiritual and inspirational, Scientific and educational, Supporting Services, Biodiversity, Soil formation, Pollination, Nutrient cycling, Provisioning Services, Food for humans","Human settlements (non agricultural), Tourism and recreation areas, Housing and urban areas, Commercial and industrial areas, Unspecified development, Water regulation, Drainage, Water abstraction, Salinisation, Water releases, Agriculture & aquaculture, Marine and freshwater aquaculture, Biological resource use, Fishing and harvesting aquatic resources, Transportation and service corridors, Roads and railroads, Shipping lanes, Aircraft flight paths, Utility and service lines (e.g., pipelines), Human intrusions & disturbance, Recreational and tourism activities, Natural system modifications, Vegetation clearance/ land conversion, Pollution, Household sewage, urban waste water, Industrial and military effluents, Garbage and solid waste, Invasive and other problematic species and genes, Invasive non-native/ alien species, Geological events, Unspecified, Climate change & severe weather, Storms and flooding, Habitat shifting and alteration","The site lies in the Thane, Mumbai and Mumbai Suburban district of Maharashtra State","Overlapping site categories, Global international legal and other formal, Other global designation","","Overlapping site categories, Non-statutory designations, Important Bird Area","No","No"
"2562","Therthangal Bird Sanctuary","Asia","India","","2024-07-15","2025-02-02","29.295","9.4592364698727","78.770638206119","<p>The Site is a marshy lake located within Therthangal village in southern Tamil Nadu. The wetland is fed by two rivers during the rainy season. Ninety-six bird species have been recorded in the Site, including the endangered Egyptian vulture (<em>Neophron percnopterus</em>) and the vulnerable Indian spotted eagle (<em>Clanga hastata</em>). The babul (<em>Acacia nilotica</em>) trees planted by the forest department provide popular nesting sites for migratory birds. In 2010, the Site was designated as a bird sanctuary. In addition to birds, the Site also supports 133 plant, 57 butterfly, 11 reptile, seven mammal, and six amphibian species. While the wetland is primarily used for water to irrigate the agricultural fields in adjacent villages, it is also a recreation and tourism site.</p>","No","Yes","Yes","Yes","No","Yes","No","No","No","Inland wetlands, Ts: Seasonal/ intermittent freshwater marshes/ pools on inorganic soils","18","16","No","Yes","Yes","Provisioning Services, Fresh water, Regulating Services, Maintenance of hydrological regimes, Erosion protection, Biological control of pests and disease, Hazard reduction, Cultural Services, Recreation and tourism, Scientific and educational, Supporting Services, Biodiversity, Soil formation, Nutrient cycling, Pollination","Human settlements (non agricultural), Housing and urban areas, Water regulation, Water abstraction, Agriculture & aquaculture, Livestock farming and ranching, Biological resource use, Fishing and harvesting aquatic resources, Human intrusions & disturbance, Recreational and tourism activities, Invasive and other problematic species and genes, Invasive non-native/ alien species, Pollution, Agricultural and forestry effluents, Climate change & severe weather, Habitat shifting and alteration, Droughts, Temperature extremes","Ramanathapuram District","","","","No","No"
"2458","Thol Lake Wildlife Sanctuary","Asia","India","","2021-04-05","2021-08-06","699","23.141657560117","72.41108723935","<p>This shallow reservoir dominated by open water areas was originally constructed for irrigation in 1912. In 1988, it was declared as a wildlife sanctuary to protect the birdlife found there: it is on the Central Asian Flyway and more than 320 bird species can be found, making up some 57% of all the bird species of Gujarat. More than 110 waterbird species have been recorded, about 43% of India&rsquo;s waterbird species, with almost 30% of those species being migratory waterbirds. More than 30 of the waterbirds are threatened, such as the critically endangered white-rumped vulture (<em>Gyps bengalensis</em>) and sociable lapwing (<em>Vanellus gregarius</em>), and the vulnerable sarus crane (<em>Grus antigone</em>), common pochard (<em>Aythya farina</em>) and lesser white-fronted goose (<em>Anser erythropus</em>)<em>.</em> This wetland regularly hosts more than 1% of the population of species including glossy ibis (<em>Plegadis falcinellus</em>). It is also essential during the dry seasons for a population of blackbuck (<em>Antilope cervicapra</em>) and other mammals in the surrounding area. The Lake provides water for drinking and irrigation and enables groundwater recharge, and is also used for recreation and tourism. The vegetation provides excellent thatching material and is also used as fodder for domestic animals.</p>","No","Yes","Yes","Yes","Yes","Yes","No","No","No","Human-made wetlands, 6: Water storage areas/Reservoirs","54","52","No","No","Yes","Provisioning Services, Fresh water, Regulating Services, Maintenance of hydrological regimes, Erosion protection, Biological control of pests and disease, Climate regulation, Cultural Services, Recreation and tourism, Scientific and educational, Supporting Services, Biodiversity, Nutrient cycling, Pollination, Soil formation","Human settlements (non agricultural), Housing and urban areas, Agriculture & aquaculture, Annual and perennial non-timber crops, Energy production and mining, Oil and gas drilling, Biological resource use, Fishing and harvesting aquatic resources, Human intrusions & disturbance, Unspecified/others, Natural system modifications, Vegetation clearance/ land conversion, Invasive and other problematic species and genes, Unspecified, Pollution, Household sewage, urban waste water, Geological events, Unspecified, Climate change & severe weather, Habitat shifting and alteration, Water regulation, Water releases, Transportation and service corridors, Roads and railroads","The area falls within the administrative jurisdiction of Mehsana district of Gujarat state, India between 23o 15’ to 23o 30’ N latitudes and 72o 30’ to 72o 45’ E longitudes. ","","","Overlapping site categories, Non-statutory designations, Important Bird Area","No","No"
"2443","Tso Kar Wetland Complex","Asia","India","","2020-11-17","2020-12-23","9577","33.298190393702","78.011888816423","<p>This high-altitude wetland complex is found at more than 4,500 metres above sea level in the Changthang region of Ladakh. The complex includes two connected lakes, the freshwater Startsapuk Tso and the larger hypersaline Tso Kar; it presents a notable example of two such lakes existing in close proximity. The name Tso Kar refers to the white salt efflorescence on the margins of the lake caused by the evaporation of the saline waters. The local climate is arid, and glacial meltwater is the primary water source for the lakes. The lakes and in particular the presence of fresh water attract biodiversity in a biologically sparse region. Inhabiting the Site are numerous threatened species including the endangered saker falcon (<em>Falco cherrug</em>) and Asiatic wild dog or dhole (<em>Cuon alpinus laniger</em>), and the vulnerable snow leopard (<em>Panthera uncia</em>). The Site also acts as an important stopover ground for migratory birds along the Central Asian Flyway and is one of the most important breeding areas in India for the black-necked crane (<em>Grus nigricollis</em>).</p>","Yes","Yes","Yes","Yes","No","No","No","No","No","Inland wetlands, Q: Permanent saline/ brackish/ alkaline lakes, O: Permanent freshwater lakes","5287","4525","No","No","No","Provisioning Services, Wetland non-food products, Regulating Services, Maintenance of hydrological regimes, Cultural Services, Recreation and tourism, Spiritual and inspirational, Supporting Services, Biodiversity","Transportation and service corridors, Roads and railroads, Biological resource use, Unspecified, Human settlements (non agricultural), Tourism and recreation areas, Agriculture & aquaculture, Livestock farming and ranching, Human intrusions & disturbance, Recreational and tourism activities, Pollution, Garbage and solid waste","Nyoma Block, Leh District, Union Territory of Ladakh.","","","Overlapping site categories, Non-statutory designations, Important Bird Area","No","No"
"1213","Tsomoriri","Asia","India","","2002-08-19","2002-08-19","12000","32.9","78.3","Tsomoriri. 19/08/02. Jammu & Kashmir. 12,000 ha. 32°54'N 078°18'E. Wetland Reserve. A freshwater to brackish lake lying at 4,595m above sea level, with wet meadows and borax-laden wetlands along the shores. The site is said to represent the only breeding ground outside of China for one of the most endangered cranes, the Black-necked crane (Grus nigricollis), and the only breeding ground for Bar-headed geese in India. The Great Tibetan Sheep or Argali (Ovis ammon hodgsoni) and Tibetan Wild Ass (Equus kiang) are endemic to the Tibetan plateau, of which the Changthang is the westernmost part. The barley fields at Korzok have been described as the highest cultivated land in the world. With no outflow, evaporation in the arid steppe conditions causes varying levels of salinity. Ancient trade routes and now major trekking routes pass the site. The 400-year-old Korzok monastery attracts many tourists, and the wetland is considered sacred by local Buddhist communities and the water is not used by them. The local community dedicated Tsomoriri as a WWF Sacred Gift for the Living Planet in recognition of WWF-India's project work there. The rapidly growing attraction of the recently opened area to western tourists (currently 2500 per summer) as an ""unspoilt destination"" with pristine high desert landscapes and lively cultural traditions brings great promise but also potential threats to the ecosystem. Ramsar site no. 1213. Most recent RIS information: 2002.","Yes","Yes","No","Yes","No","No","No","No","No","Inland wetlands, Q: Permanent saline/ brackish/ alkaline lakes","4595","4595","No","No","In preparation","Cultural Services, Spiritual and inspirational, Recreation and tourism, Provisioning Services, Wetland non-food products","Transportation and service corridors, Roads and railroads, Unspecified, Human settlements (non agricultural), Tourism and recreation areas, Agriculture & aquaculture, Livestock farming and ranching, Pollution, Garbage and solid waste, Human intrusions & disturbance, Recreational and tourism activities, Biological resource use, Unspecified","Eastern Ladakh, Jammu & Kashmir","","","","No","No"
