"2545","Nagi Bird Sanctuary","Asia","India","","2023-10-11","2024-06-04","205.817","24.817127768954","86.407806727611","<p>The Site was created following the damming of the Nagi River, which enabled the gradual formation of water bodies with clear water and aquatic vegetation. The catchment area, largely dry deciduous forest, is surrounded by hills. Due to its importance for migratory bird species, the Site was recognized locally as a Bird Sanctuary in 1984, and internationally as an Important Bird and Biodiversity Area (IBA) by BirdLife International. Threatened migratory species that winter at the Site include the critically endangered Baer&rsquo;s pochard (<em>Aythya baeri</em>) and the endangered steppe eagle (<em>Aquila nipalensis</em>). Overall, the wetland and its fringes provide habitat for over 75 bird species, 33 fish, and 12 aquatic plants. Notably, the Site hosts one of the largest congregations of bar-headed goose (<em>Anser indicus</em>) on the Indo-Gangetic plain. Additionally, the wetland provides a reliable source of water for the irrigation of over 9,800 acres of agricultural land, and serves as a location for recreation, tourism, and educational activities.</p>","No","Yes","Yes","Yes","Yes","Yes","No","No","No","Human-made wetlands, 6: Water storage areas/Reservoirs","140","116","No","Yes","Yes","Provisioning Services, Food for humans, Fresh water, Wetland non-food products, Biochemical products, Regulating Services, Maintenance of hydrological regimes, Erosion protection, Climate regulation, Pollution control and detoxification, Hazard reduction, Cultural Services, Recreation and tourism, Scientific and educational, Supporting Services, Biodiversity, Soil formation, Nutrient cycling","Human settlements (non agricultural), Unspecified development, Water regulation, Drainage, Water abstraction, Agriculture & aquaculture, Annual and perennial non-timber crops, Livestock farming and ranching, Marine and freshwater aquaculture, Biological resource use, Fishing and harvesting aquatic resources, Unspecified, Human intrusions & disturbance, Unspecified/others, Natural system modifications, Dams and water management/use, Vegetation clearance/ land conversion, Invasive and other problematic species and genes, Invasive non-native/ alien species, Problematic native species","The Site lies in the Jamui District of Bihar State in India","","","Overlapping site categories, Non-statutory designations, Important Bird Area, Other non-statutory designation","No","No"
"2546","Nakti Bird Sanctuary","Asia","India","","2023-10-11","2024-06-04","332.608","24.847388505534","86.447319500269","<p>The Site is a man-made wetland which was developed primarily for irrigation through the construction of Nakti Dam. Since the dam&rsquo;s construction, the wetland and its surrounding area have provided habitat for over 150 species of birds, mammals, fish, aquatic plants, and reptiles and amphibians. They include globally threatened species, including the endangered Indian elephant (<em>Elephas maximus indicus</em>) and a vulnerable native catfish (<em>Wallago attu</em>). The catchment area is largely dry deciduous forest, and is surrounded by hills. In 1984, the wetland was designated as a Bird Sanctuary, highlighting its importance as a wintering habitat for several migratory species, with over 20,000 birds congregating during winter months. This includes one of the largest congregations of red-crested pochard (<em>Netta rufina</em>) on the Indo-Gangetic plain. Alongside its function supporting the agricultural and domestic water demands of local communities, the Site is popular as a recreational birdwatching site.</p>","No","Yes","Yes","Yes","Yes","Yes","No","No","No","Human-made wetlands, 6: Water storage areas/Reservoirs","163","166","No","No","Yes","Provisioning Services, Food for humans, Wetland non-food products, Genetic materials, Fresh water, Regulating Services, Erosion protection, Climate regulation, Maintenance of hydrological regimes, Pollution control and detoxification, Cultural Services, Spiritual and inspirational, Scientific and educational, Recreation and tourism, Supporting Services, Biodiversity, Soil formation, Nutrient cycling","Water regulation, Drainage, Climate change & severe weather, Temperature extremes, Human settlements (non agricultural), Unspecified development, Agriculture & aquaculture, Annual and perennial non-timber crops, Human intrusions & disturbance, Unspecified/others, Natural system modifications, Dams and water management/use, Invasive and other problematic species and genes, Invasive non-native/ alien species, Problematic native species, Pollution, Household sewage, urban waste water, Agricultural and forestry effluents, Garbage and solid waste","The Nakti Bird Sanctuary is located in the Jamui district of the State of Bihar","","","Overlapping site categories, Non-statutory designations, Important Bird Area, Other non-statutory designation","No","No"
"2078","Nalsarovar","Asia","India","","2012-09-24","2012-09-24","12000","22.7758333333","72.0391666667","Nalsarovar Bird Sanctuary. 24/09/12; Gujarat; 12,000 ha; 22°46'33""N 072°02'21""E. Wildlife Sanctuary. A natural freshwater lake (a relict sea) that is the largest natural wetland in the Thar Desert Biogeographic Province and represents a dynamic environment with salinity and depth varying depending on rainfall. The area is home to 210 species of birds, with an average 174,128 individuals recorded there during the winter and 50,000 in the summer. It is an important stopover site within the Central Asia Flyway, with globally threatened species such as the critically endangered Sociable Lapwing (Vanellus gregarius) and the vulnerable Marbled Teal (Marmaronetta angustirostris) stopping over at the site during migration, while the vulnerable Sarus Crane (Grus antigone) takes refuge there during summer when other water bodies are dry. The wetland is also a lifeline for a satellite population of the endangered Indian Wild Ass (Equus hemionus khur) which uses this area in the dry season. Local communities heavily rely on the lake as it provides them with a source of drinking water and water for irrigiation, as well as an important source of income from fishing for Catla fish (Catla Catla) and Rohu (Labeo rohita). An average of 75,000 tourists visit the wetland annually. Ramsar Site no. 2078. Most recent RIS information: 2012.","Yes","Yes","Yes","Yes","Yes","Yes","No","No","No","Inland wetlands, O: Permanent freshwater lakes, P: Seasonal/ intermittent freshwater lakes, Q: Permanent saline/ brackish/ alkaline lakes, R: Seasonal/ intermittent saline/ brackish/ alkaline lakes and flats","9","9","No","Yes","Yes","Regulating Services, Hazard reduction, Maintenance of hydrological regimes, Provisioning Services, Fresh water, Food for humans, Wetland non-food products, Cultural Services, Spiritual and inspirational","Water regulation, Water abstraction, Pollution, Industrial and military effluents, Biological resource use, Fishing and harvesting aquatic resources","Gujarat State","","","","No","No"
"2471","Nanda Lake","Asia","India","","2022-06-08","2022-08-03","42.01","15.23687264961","74.107499427506","<p>Nanda Lake comprises intermittent freshwater marshes that lie adjacent to one of the major tributaries of the Zuari River. They are linked to the adjacent river channel by a sluice gate, which when closed enables the flooding of the marshes. This wetland supports a wide variety of migratory waterbirds and many other important plants and animals. Notable bird species include black-headed ibis (<em>Threskiornis melanocephalus</em>), common kingfisher (<em>Alcedo atthis</em>), wire-tailed swallow (<em>Hirundo smithii</em>), bronze-winged jacana (<em>Metopidius indicus</em>), brahminy kite (<em>Haliastur indus</em>), intermediate egret (<em>Ardea intermedia</em>), little cormorant (<em>Microcarbo niger</em>) and lesser whistling duck (<em>Dendrocygna javanica</em>). The Site enables local communities to store water during the off-monsoon season, to cultivate rice paddies downstream of the lake and support fishing and recreation. The lake also protects downstream areas from monsoon floods. Threats include invasive non-native species, garbage and solid waste, overfishing, and harvesting of aquatic resources. However, there is no management plan to address these issues.</p>","Yes","Yes","Yes","No","No","No","No","No","No","Inland wetlands, Ts: Seasonal/ intermittent freshwater marshes/ pools on inorganic soils","","","No","No","No","Provisioning Services, Fresh water, Food for humans, Wetland non-food products, Regulating Services, Maintenance of hydrological regimes, Hazard reduction, Erosion protection, Climate regulation, Biological control of pests and disease, Cultural Services, Spiritual and inspirational, Supporting Services, Biodiversity","Human settlements (non agricultural), Housing and urban areas, Water regulation, Canalisation and river regulation, Biological resource use, Fishing and harvesting aquatic resources, Natural system modifications, Dams and water management/use, Invasive and other problematic species and genes, Problematic native species, Invasive non-native/ alien species, Pollution, Household sewage, urban waste water, Garbage and solid waste, Climate change & severe weather, Storms and flooding","Quepem municipality, Village Quepem, Quepem Taluka, South Goa, Goa, India","","","","No","No"
"2410","Nandur Madhameshwar","Asia","India","","2019-06-21","2020-02-01","1437","20.021732701513","74.106771225151","<p>The Site is a mosaic of lakes, marshes and riparian forest on the Deccan Plateau. Construction of the Nandur Madhameshwar Weir at the confluence of the Godavari and Kadwa Rivers helped create a thriving wetland: originally designed to overcome water shortages in the surrounding area, the Site now also serves as a buffer against floodwaters and as a biodiversity hotspot. With 536 species recorded, its diverse habitats contrast with the surrounding semi-arid conditions caused by the rain shadow of the Western Ghats mountain range. The Site hosts some of India&rsquo;s most iconic species, such as the leopard and Indian sandalwood (<em>Santalum album</em>). It also provides sanctuary to critically endangered species including Deolali minnow (<em>Parapsilorhynchus prateri</em>), Indian vulture (<em>Gyps indicus</em>) and white-rumped vulture (<em>Gyps bengalensis</em>). Invasive species including common water hyacinth (<em>Eichhornia crassipes</em>) threaten the Site, along with the effects of urban development and water abstraction. The Office of the Conservator of Forest (Wildlife) manages the Site.</p>","No","Yes","Yes","Yes","Yes","Yes","Yes","Yes","No","Inland wetlands, P: Seasonal/ intermittent freshwater lakes, Ts: Seasonal/ intermittent freshwater marshes/ pools on inorganic soils, M: Permanent rivers/ streams/ creeks, Tp: Permanent freshwater marshes/ pools, O: Permanent freshwater lakes, Human-made wetlands, 6: Water storage areas/Reservoirs, 9: Canals and drainage channels or ditches, 2: Ponds","536","514","No","Yes","Yes","Provisioning Services, Food for humans, Fresh water, Regulating Services, Maintenance of hydrological regimes, Erosion protection, Climate regulation, Biological control of pests and disease, Hazard reduction, Cultural Services, Recreation and tourism, Spiritual and inspirational, Scientific and educational, Supporting Services, Biodiversity, Soil formation, Nutrient cycling","Transportation and service corridors, Roads and railroads, Invasive and other problematic species and genes, Invasive non-native/ alien species, Introduced genetic material, Climate change & severe weather, Habitat shifting and alteration, Storms and flooding, Droughts, Temperature extremes, Human settlements (non agricultural), Tourism and recreation areas, Housing and urban areas, Water regulation, Canalisation and river regulation, Drainage, Water abstraction, Water releases, Natural system modifications, Vegetation clearance/ land conversion, Dams and water management/use, Biological resource use, Fishing and harvesting aquatic resources, Agriculture & aquaculture, Annual and perennial non-timber crops, Livestock farming and ranching, Marine and freshwater aquaculture, Human intrusions & disturbance, Recreational and tourism activities, Pollution, Household sewage, urban waste water, Industrial and military effluents, Agricultural and forestry effluents","Maharashtra, India","","","Overlapping site categories, Non-statutory designations, Important Bird Area","No","No"
"2407","Nangal Wildlife Sanctuary","Asia","India","","2019-09-26","2020-02-01","116","31.396275298627","76.37129634987","<p>Located in the Shiwalik foothills of Punjab is the highly eco-sensitive Nangal Wildlife Sanctuary, which supports abundant flora and fauna including threatened species, such as the endangered Indian pangolin (<em>Manis crassicaudata</em>) and Egyptian vulture (<em>Neophron percnopterus</em>) and the vulnerable leopard (<em>Panthera pardus</em>). It occupies a human-made reservoir constructed as part of the Bhakra-Nangal Project in 1961. The site is of historic importance as the Indian and Chinese Prime Ministers formalized the &ldquo;Five Principles of Peaceful Coexistence&rdquo; there in 1954. More than half a million people downstream benefit from the reservoir as the flow of water is regulated, reducing the risks to both people and property from&nbsp;floods. The Department of Forests and Wildlife Preservation (Rupnagar Wildlife Division), Punjab is responsible for managing the Sanctuary.</p>","No","Yes","Yes","No","No","No","No","No","No","Human-made wetlands, 6: Water storage areas/Reservoirs, Inland wetlands, M: Permanent rivers/ streams/ creeks","330","326","No","No","No","Cultural Services, Scientific and educational, Recreation and tourism, Spiritual and inspirational, Supporting Services, Biodiversity, Pollination, Regulating Services, Maintenance of hydrological regimes, Provisioning Services, Food for humans, Fresh water, Wetland non-food products","Human settlements (non agricultural), Housing and urban areas, Tourism and recreation areas, Water regulation, Canalisation and river regulation, Agriculture & aquaculture, Annual and perennial non-timber crops, Biological resource use, Gathering terrestrial plants, Logging and wood harvesting, Human intrusions & disturbance, Recreational and tourism activities, Natural system modifications, Dams and water management/use, Invasive and other problematic species and genes, Invasive non-native/ alien species, Pollution, Household sewage, urban waste water, Agricultural and forestry effluents, Garbage and solid waste","Rupnagar","","","","No","No"
"2549","Nanjarayan Bird Sanctuary","Asia","India","","2024-01-16","2024-08-26","125.865","11.134389983936","77.386125173897","<p>The Site is a freshwater lake located within Neruperichal and Sarkar Periyapalayam villages in Tiruppur district, Tamil Nadu. It holds historical significance, having been named after King Nanjarayan who constructed the reservoir 400 years ago. The lake&rsquo;s water levels fluctuate based on rainfall and runoff from the surrounding catchment area and Nallar River. During periods of high rainfall, excess water is diverted to Sarkar Periyapalayam village for irrigation. In 2022, the Site was designated as a Bird Sanctuary. Gum arabic trees (<em>Vachellia nilotica</em>) on the bunds of the lake provide refuge and nesting habitats for waterbirds such as the Indian darter (<em>Anhinga melanogaster</em>) and Indian cormorant (<em>Phalacrocorax fuscicollis</em>). The wetland banks also provide suitable breeding grounds for the Indian flapshell turtle (<em>Lissemys punctata</em>). Overall, the lake and its environs host 191 species of birds, 87 butterflies, 77 plants, 21 reptiles, 11 small mammals and 7 amphibians. The local villages rely on the lake for agricultural activities, while the forest department manages the Site in collaboration with established local community groups.</p>","No","Yes","Yes","Yes","No","Yes","No","No","No","Inland wetlands, O: Permanent freshwater lakes","290","285","No","Yes","Yes","Provisioning Services, Food for humans, Fresh water, Regulating Services, Maintenance of hydrological regimes, Erosion protection, Climate regulation, Biological control of pests and disease, Cultural Services, Recreation and tourism, Supporting Services, Biodiversity, Nutrient cycling","Water regulation, Drainage, Canalisation and river regulation, Pollution, Household sewage, urban waste water, Climate change & severe weather, Habitat shifting and alteration, Droughts, Temperature extremes, Human settlements (non agricultural), Housing and urban areas, Agriculture & aquaculture, Marine and freshwater aquaculture, Natural system modifications, Dams and water management/use, Invasive and other problematic species and genes, Invasive non-native/ alien species","The wetland is situated at a distance of approximately 10 kms from Tiruppur town on the north side on the Tiruppur-Uthukuli main road. Nanjarayan Lake Bird Sanctuary is locally known as ","","","","No","No"
"2412","Nawabganj Bird Sanctuary","Asia","India","","2019-09-19","2020-02-01","224.6","26.613748563693","80.65495285113","<p>A shallow marshland 45 kilometres from Lucknow in Uttar Pradesh. Monsoon rains feed this diverse wetland while the Sarda Canal supplies additional water. The Sanctuary supports recreation and tourism activities as well as local biodiversity. It is a haven for birds, with 25,000 waterbirds regularly recorded and 220 resident and migratory species documented. Among these are globally threatened species including the endangered Egyptian vulture (<em>Neophron percnopterus</em>) and Pallas&rsquo;s fish eagle (<em>Haliaeetus leucoryphus</em>) as well as the vulnerable lesser adjutant (<em>Leptoptilos javanicus</em>) and woolly-necked stork (<em>Ciconia episcopus</em>). Protection and afforestation measures have helped increase the overall diversity of wildlife, with golden jackal (<em>Canis aureus</em>) and jungle cat (<em>Felis chaus</em>) now present. The highly invasive common water hyacinth (<em>Eichhornia crassipes</em>) poses a threat, as does the removal of timber from the forests. State forest officers along with the Office of the Conservator of Forest (Wildlife) jointly manage the Sanctuary.</p>","No","Yes","Yes","Yes","Yes","Yes","No","No","No","Inland wetlands, Ts: Seasonal/ intermittent freshwater marshes/ pools on inorganic soils","113","110","No","Yes","Yes","Regulating Services, Maintenance of hydrological regimes, Cultural Services, Recreation and tourism, Supporting Services, Biodiversity","Agriculture & aquaculture, Annual and perennial non-timber crops, Water regulation, Canalisation and river regulation, Invasive and other problematic species and genes, Invasive non-native/ alien species","Nawabganj Bird Sanctuary is situated in Hasanganj tehsil of Unnao district of Uttar Pradesh, India. It is about 50 Km from Lucknow on the Lucknow-Kanpur highway. It is 18 Km from district head quarter Unnao.","","","Overlapping site categories, Non-statutory designations, Important Bird Area","No","No"
"2484","Pala Wetland","Asia","India","","2021-08-31","2022-07-25","1850","22.19710038801","92.902198105542","<p>Pala Wetland is the largest natural wetland in the state of Mizoram. The Site includes a relatively deep lake (over 16 metres deep on average) and its surrounding forest catchment area which climbs to almost 600m above sea level. The wetland supports a rich diversity of animal species, including at least seven mammals, 222 birds, 11 amphibians and 21 reptiles. The low-lying marshy areas within the wetland provide excellent habitat for many herbivores such as sambar deer (<em>Cervus unicolor</em>), wild pig (<em>Sus scrofa</em>) and barking deer (<em>Muntiacus muntjak</em>). Various species of primate also inhabit the wetland, such as the endangered Hoolock gibbon (<em>Hoolock hoolock</em>) and Phayre&rsquo;s leaf monkey (<em>Trachypithecus phayrei</em>). Pala Wetland is revered by the local Mara people and has a deep connection with their history. The wetland is the major source of freshwater and fish for the villages at its fringe and also the major source of irrigation water for wet rice cultivation, horticulture and other forms of agriculture. Although classified as a Wetland Reserve by the national authorities, the Site is threatened by the construction of roads and railroads, hunting and collecting of land animals, illegal logging and wood harvesting. However, a management plan is being implemented to mitigate these threats.</p>","Yes","Yes","Yes","Yes","No","No","No","No","No","Inland wetlands, Xf: Freshwater, tree-dominated wetlands, O: Permanent freshwater lakes","589","274","No","Yes","Yes","Regulating Services, Maintenance of hydrological regimes, Erosion protection, Cultural Services, Spiritual and inspirational, Recreation and tourism, Scientific and educational, Provisioning Services, Food for humans, Fresh water, Wetland non-food products, Supporting Services, Pollination, Biodiversity, Nutrient cycling","Human settlements (non agricultural), Housing and urban areas, Water regulation, Canalisation and river regulation, Agriculture & aquaculture, Livestock farming and ranching, Transportation and service corridors, Roads and railroads, Biological resource use, Hunting and collecting terrestrial animals, Logging and wood harvesting, Human intrusions & disturbance, Recreational and tourism activities, Natural system modifications, Vegetation clearance/ land conversion, Invasive and other problematic species and genes, Invasive non-native/ alien species, Geological events, Earthquakes/tsunamis, Climate change & severe weather, Habitat shifting and alteration","Mizoram","","","","No","No"
"2481","Pallikaranai Marsh Reserve Forest","Asia","India","","2022-04-08","2022-07-25","1247.537","12.927845763295","80.220484456914","<p>This freshwater marsh and partly saline wetland situated about 20 kilometres south of the city of Chennai serves as an aquatic buffer of the flood-prone Chennai and Chengalpattu districts. The diverse ecosystem of the marshland supports some 115 bird species, ten mammals, 21 reptiles, ten amphibians, 46 fish, nine molluscs, five crustaceans, and seven butterfly species. These include notable species such as Russell&rsquo;s viper (<em>Daboia siamensis</em>) and birds such as the glossy ibis (<em>Plegadis falcinellus</em>), grey-headed lapwings (<em>Vanellus cinereus</em>) and Pheasant-tailed jacana (<em>Hydrophasianus chirurgus</em>). Apart from its biodiversity value, the wetland also plays a vital role in the prevention of flooding for the city of Chennai, soaking up water during wet periods and releasing it during dry spells. Inhabitants of seven surrounding villages partially depend on the wetland for their subsistence. The Site is threatened by invasive and non-native species, household sewage, urban wastewater and droughts. In response, the Conservation Authority of Pallikaranai Marsh is currently implementing a site-specific management plan.</p>","Yes","Yes","Yes","Yes","No","Yes","Yes","Yes","No","Inland wetlands, Ss: Seasonal/ intermittent saline/ brackish/ alkaline marshes/ pools, Marine or coastal wetlands, H: Intertidal marshes","4","2","No","No","Yes","Provisioning Services, Fresh water, Wetland non-food products, Food for humans, Regulating Services, Maintenance of hydrological regimes, Erosion protection, Hazard reduction, Climate regulation, Biological control of pests and disease, Cultural Services, Recreation and tourism, Spiritual and inspirational, Scientific and educational, Supporting Services, Biodiversity, Soil formation, Nutrient cycling","Biological resource use, Unspecified, Human settlements (non agricultural), Commercial and industrial areas, Housing and urban areas, Unspecified development, Water regulation, Water abstraction, Water releases, Agriculture & aquaculture, Livestock farming and ranching, Non specified, Energy production and mining, Unspecified, Transportation and service corridors, Roads and railroads, Human intrusions & disturbance, Unspecified/others, Natural system modifications, Vegetation clearance/ land conversion, Unspecified/others, Invasive and other problematic species and genes, Invasive non-native/ alien species, Pollution, Household sewage, urban waste water, Industrial and military effluents, Garbage and solid waste, Air-borne pollutants, Excess heat, sound, light, Geological events, Unspecified, Climate change & severe weather, Habitat shifting and alteration, Droughts, Temperature extremes, Storms and flooding","Chennai City","Overlapping site categories, Global international legal and other formal, Other global designation","Overlapping site categories, Regional international legal and other formal designations, Other international designation","Overlapping site categories, Non-statutory designations, Important Bird Area, Other non-statutory designation","No","No"
